Ostrich Fern,Matteuccia struthiopteris,,Fern,Native,No,Foliage Interest,Tall,Part Sun–Shade,Mesic–Moist,Upright vase shape; prefers moist shade,https://inaturalist-open-data.s3.amazonaws.com/photos/394351700/medium.jpeg,,Matrix,M,Medium,2 - Marginal,1 - Don't Use,3 - OK,5 - Best Fit,4 - Strong,3 - OK,2 - Marginal,Yes,Yes,Yes,Yes,Herbaceous,4,,medium,low,low,no,no,no,unknown,avoid,avoid,May,June,"Fern — produces spores, not seeds",5,"Ground layering works well — pin a low branch to moist soil in spring, sever the following year once rooted.",with caveats,Fiddleheads edible cooked; do not eat raw,no,,,Spring–Fall,3,10,,,Matteuccia struthiopteris
Meehan's mint,Meehania cordata,,Groundcover,Native,No,Flowers,Low,Shade,Mesic,Spreading mint,https://static.inaturalist.org/photos/132262926/medium.jpeg,,Ground layer,Y,Small,3 - OK,1 - Don't Use,4 - Strong,3 - OK,5 - Best Fit,4 - Strong,1 - Don't Use,Yes,Yes,Yes,Yes,Herbaceous,1,green,low,low,low,no,no,no,tolerant,tolerant,tolerant,May,June,Spreads quickly,10,Excellent fill plant,no,,no,,purple,Spring,3,5,purple,#7B4EA0,Meehania cordata
Partridgeberry,Mitchella repens,,Groundcover,Native,Yes,Fall,Low,Shade,Mesic,Evergreen woodland floor,https://inaturalist-open-data.s3.amazonaws.com/photos/40064/medium.jpg,,Ground,N,Small,2 - Marginal,1 - Don't Use,3 - OK,3 - OK,4 - Strong,5 - Best Fit,2 - Marginal,Yes,Yes,Yes,Yes,Herbaceous,0.25,dark green,medium,low,low,no,no,no,unknown,tolerant,marginal,September,October,Red berries persist; clean pulp; cold stratify,5,Divide in early spring; spreads slowly — leave undisturbed if possible,with caveats,Berries edible; insipid flavor,no,,white | pink,N/A,,,white | pink,#FFFFFF,Mitchella repens
Wild Bergamot,Monarda fistulosa,,Flowering Perennial,Native,No,N/A,Tall,Full Sun–Part Sun,Dry–Mesic,Bee balm + scent,https://inaturalist-open-data.s3.amazonaws.com/photos/301795454/medium.jpg,,Anchor,M,Small,4 - Strong,5 - Best Fit,4 - Strong,3 - OK,3 - OK,1 - Don't Use,4 - Strong,Yes,Yes,Yes,Yes,Herbaceous,3,,low,low,low,no,no,no,unknown,avoid,avoid,August,September,Small nutlets; strip dried calyces from stem,25,"Ground layering works well — pin a low branch to moist acidic soil in spring, sever the following year. Division not practical; layering is the easiest home propagation method.",with caveats,Leaves used as tea herb; aromatic,yes,Traditional medicinal herb; used for respiratory and digestive complaints,lavender | pink,N/A,,,lavender | pink,#9B89C4,Monarda fistulosa
Spotted Beebalm,Monarda punctata,,Flowering Perennial,Native,No,N/A,Mid,Full Sun,Dry,Dry sandy solar slopes,https://inaturalist-open-data.s3.amazonaws.com/photos/9440970/medium.jpeg,,,,,5 - Best Fit,5 - Best Fit,3 - OK,1 - Don't Use,1 - Don't Use,1 - Don't Use,5 - Best Fit,Yes,Yes,Yes,Yes,Herbaceous,2,,low,low,low,no,no,no,unknown,avoid,avoid,August,September,Small dry nutlets; strip from stem,25,"Live staking works — cut stems in late winter before bud break, push 2/3 into moist soil. Also divide suckers in early spring or fall.",no,,yes,Traditional medicinal herb,yellow | purple,N/A,,,yellow | purple,#F9C820,Monarda punctata
Sand Myrtle,Morella caroliniensis,,Shrub – Small,Native,Yes,Aromatic foliage,Medium,Sun,Dry,Shrub adapted to dry sandy soils and barrens habitats,https://static.inaturalist.org/photos/38525281/medium.jpg,,Wildlife shrub,N,Medium,4 - Strong,5 - Best Fit,3 - OK,1 - Don't Use,1 - Don't Use,1 - Don't Use,5 - Best Fit,No,Yes,No,Yes,Shrub,3,dark green,low,low,low,no,no,no,unknown,marginal,avoid,September,October,Gray-white waxy berries; clean pulp,40,Division not practical; best from softwood cuttings in summer,no,,with caveats,Wax from berries used historically; not a food plant,,Spring,3,5,,,Morella caroliniensis
Red Mulberry,Morus rubra,,Midstory Tree,Native,No,Summer fruit; wildlife value,Structural,Full Sun–Part Sun,Mesic,Extremely productive fruit beloved by birds — a single tree can feed dozens of species during fruiting season. Native mulberry (not to be confused with invasive white mulberry).,https://inaturalist-open-data.s3.amazonaws.com/photos/37595678/medium.jpg,,Woody,N,Large,3 - OK,3 - OK,4 - Strong,4 - Strong,4 - Strong,2 - Marginal,3 - OK,Yes,Yes,Yes,Yes,Tree,65,,low,low,low,no,no,no,unknown,marginal,marginal,June,July,Dark red to purple fruit; collect when ripe; clean pulp; cold stratify,100,Best from fresh seed; softwood cuttings also possible,yes,Edible fruit; sweet mulberries,no,,yellow | green,Late Spring,4,5,yellow | green,#F9C820,Morus rubra
Sweet Gale,Myrica gale,,Shrub – Small,Native,Yes,Bog shrub,Medium,Sun–Part Shade,Wet,Nitrogen-fixing shrub adapted to wetlands and peat soils,https://inaturalist-open-data.s3.amazonaws.com/photos/92015224/medium.jpeg,,Wildlife shrub,N,Medium,3 - OK,1 - Don't Use,2 - Marginal,5 - Best Fit,4 - Strong,3 - OK,1 - Don't Use,Yes,Yes,Yes,Yes,Shrub,3,,low,low,low,no,no,no,unknown,avoid,avoid,August,September,Small waxy nutlets; cold stratify,40,Division not practical; best from softwood cuttings in summer,with caveats,Used as spice in small amounts,no,,,Spring,3,5,,,Myrica gale
Northern bayberry,Myrica pensylvanica,,Shrub – Large,Native,Y,Gray berries,Shrub,Full Sun,Dry to Mesic,Nitrogen fixing shrub,https://inaturalist-open-data.s3.amazonaws.com/photos/151276750/medium.jpg,,Understory fill,Y,Small to Medium,4 - Strong,5 - Best Fit,4 - Strong,2 - Marginal,3 - OK,2 - Marginal,5 - Best Fit,Yes,Yes,Yes,Yes,Shrub,8,dark green,low,low,low,no,no,no,tolerant,marginal,avoid,September,October,Gray-white waxy berries; clean pulp,40,Division not practical; best from softwood cuttings in summer,no,,with caveats,Wax from berries used historically,white,Spring,3,5,white,#FFFFFF,Myrica pensylvanica
Catmint,Nepeta x faassenii,,Flowering Perennial,Safe Non-Native,No,Spring / Summer,Mid,Full Sun,Dry,"long-season color, drought tolerant",https://inaturalist-open-data.s3.amazonaws.com/photos/155914545/medium.jpg,,,,,5 - Best Fit,5 - Best Fit,4 - Strong,2 - Marginal,3 - OK,1 - Don't Use,5 - Best Fit,No,No,No,No,Herbaceous,2,silver,low,low,low,no,no,no,unknown,avoid,avoid,July,August,Hybrid — seeds not reliably true to type,0,Divide in early spring or fall; spreads by rhizome,with caveats,Leaves used as herbal tea,no,,lavender | blue,Late Spring,4,5,lavender | blue,#9B89C4,Nepeta x faassenii
Blue Toadflax / Canada Toadflax,Nuttallanthus canadensis,,Flowering Perennial,Native,No,Delicate blue-violet flowers; dry pioneer,Low,Full Sun,Dry,"Delicate native annual/biennial of sandy, gravelly, and rocky dry soils. Slender stems with tiny blue-violet snapdragon-like flowers. Excellent for dry meadow and barrens colonization. Self-seeding. A distinctive component of sandy open habitats — often overlooked but ecologically important.",https://inaturalist-open-data.s3.amazonaws.com/photos/313340/medium.jpg,,Matrix,N,Small,2 - Marginal,5 - Best Fit,2 - Marginal,1 - Don't Use,1 - Don't Use,1 - Don't Use,5 - Best Fit,Yes,Yes,Yes,Yes,Herbaceous,1.5,green,low,low,low,no,no,no,unknown,marginal,avoid,June,July,Small capsules; collect before they shatter; direct sow on bare sandy soil in fall,3,Direct sow in fall or early spring on bare soil; self-seeds reliably in suitable open sandy conditions,no,,no,,blue | violet,Spring–Early Summer,4,6,blue | violet,#4A7FC1,Nuttallanthus canadensis
Tupelo / Black Gum,Nyssa sylvatica,,Tree - Large,Native,No,Fall color,Structural,Full Sun–Part Sun,Mesic–Moist,"One of the best native trees for fall color — brilliant scarlet very early in the season. Blue-black fruit is critical for migratory birds in fall. Tolerates wet soils and occasional flooding. Very long-lived. Mature trees can drop a lot of seed balls, which can be a bit of a nuissance but not harmful. ",https://inaturalist-open-data.s3.amazonaws.com/photos/197904434/medium.jpg,,Woody,N,Large,2 - Marginal,2 - Marginal,4 - Strong,5 - Best Fit,4 - Strong,3 - OK,2 - Marginal,Yes,Yes,Yes,Yes,Tree,50,,low,low,low,no,no,no,unknown,marginal,avoid,September,October,Blue-black drupes; clean pulp; cold stratify,35,Best from fresh seed; difficult to transplant once established — buy balled-and-burlapped or container grown,with caveats,Fruit edible but very sour; best for jellies,no,,white | cream,Late Spring,4,5,white | cream,#FFFFFF,Nyssa sylvatica
Sensitive Fern,Onoclea sensibilis,,Fern,Native,No,Summer,Mid,Part Sun–Shade,Mesic–Moist,Best in damp meadows & bog edges,https://inaturalist-open-data.s3.amazonaws.com/photos/200080819/medium.jpg,,Matrix,M,Medium,2 - Marginal,1 - Don't Use,2 - Marginal,5 - Best Fit,4 - Strong,2 - Marginal,2 - Marginal,Yes,Yes,Yes,Yes,Herbaceous,2,,low,low,low,no,no,no,unknown,avoid,avoid,June,August,"Fern — produces spores, not seeds",5,Divide in early spring as fronds emerge; spreads readily,with caveats,Fiddleheads edible cooked; do not eat raw,no,,,N/A,,,,,Onoclea sensibilis
Eastern Prickly Pear,Opuntia humifusa,,Flowering Perennial,Native,Yes,Yellow flowers; red-purple winter pads; edible fruit,Low,Full Sun,Dry,"The only cold-hardy cactus native to the Northeast. Striking yellow flowers in early summer. Pads turn red-purple in winter. Restricted to hot, dry, sandy or rocky sites — pine barrens, sand plains, rocky outcrops. Remarkable ecological and visual outlier for xeric plantings.",https://inaturalist-open-data.s3.amazonaws.com/photos/169468708/medium.jpeg,,Matrix,N,Small,5 - Best Fit,5 - Best Fit,2 - Marginal,1 - Don't Use,1 - Don't Use,1 - Don't Use,5 - Best Fit,Yes,Yes,Yes,No,Herbaceous,1,green (red-purple in winter),low,low,low,no,no,no,unknown,unknown,avoid,September,October,Fleshy red-purple fruit; clean and dry seeds; sow in spring on sandy soil,5,Pad cuttings in summer — allow cut end to callus before planting in dry sandy soil; very easy,yes,Pads (nopalitos) and fruit edible after removing spines and glochids,no,,yellow,Early Summer,5,6,yellow,#F9C820,Opuntia humifusa
Interrupted Fern,Osmunda claytoniana,,Fern,Native,No,Foliage Interest,Tall,Part Sun–Shade,Mesic–Moist,Woodland fern tolerant of varied moisture,https://inaturalist-open-data.s3.amazonaws.com/photos/33125132/medium.jpeg,,Anchor,N,Medium,3 - OK,2 - Marginal,4 - Strong,3 - OK,5 - Best Fit,3 - OK,2 - Marginal,Yes,Yes,Yes,Yes,Herbaceous,4,,low,low,low,no,no,no,unknown,marginal,avoid,May,June,"Fern — produces spores, not seeds",5,"Ground layering works well — pin a low branch to moist soil in spring, sever the following year once rooted.",with caveats,Fiddleheads edible cooked; do not eat raw,no,,,Spring–Fall,3,10,,,Osmunda claytoniana
Royal Fern,Osmunda regalis,,Fern,Native,No,Foliage Interest,Tall,Part Sun–Shade,Moist–Wet,Moisture-loving fern with tall fronds,https://static.inaturalist.org/photos/49002953/medium.jpeg,,Anchor,N,Medium,3 - OK,1 - Don't Use,3 - OK,5 - Best Fit,4 - Strong,3 - OK,2 - Marginal,Yes,Yes,Yes,Yes,Herbaceous,4,,low,low,low,no,no,no,unknown,avoid,avoid,May,June,"Fern — produces spores, not seeds",5,"Ground layering works well — pin a low branch to moist soil in spring, sever the following year once rooted.",with caveats,Fiddleheads edible cooked; do not eat raw,no,,,Spring–Fall,3,10,,,Osmunda regalis
Cinnamon Fern,Osmundastrum cinnamomeum,,Fern,Native,No,Cinnamon fertile fronds,Tall,Part Shade–Shade,Moist,Large moisture-loving fern; bold structural presence,https://static.inaturalist.org/photos/75969516/medium.jpg,,Understory fill,N,Large,3 - OK,1 - Don't Use,4 - Strong,5 - Best Fit,4 - Strong,4 - Strong,1 - Don't Use,Yes,Yes,Yes,Yes,Herbaceous,5,,low,low,low,no,no,no,unknown,avoid,avoid,May,June,"Fern — produces spores, not seeds",5,Divide in early spring as fronds emerge; keep moist,with caveats,Fiddleheads edible cooked; do not eat raw,no,,,Spring–Fall,3,10,,,Osmundastrum cinnamomeum
Hop-hornbeam / Ironwood,Ostrya virginiana,,Tree - Small,Native,No,,Structural,Full Sun–Part Sun,Mesic,Hardwood understory tree,https://inaturalist-open-data.s3.amazonaws.com/photos/15550/medium.jpg,,Woody,N,Medium,4 - Strong,2 - Marginal,4 - Strong,4 - Strong,4 - Strong,3 - OK,4 - Strong,Yes,Yes,Yes,Yes,Tree,30,,high,medium,low,no,no,no,tolerant,tolerant,marginal,August,September,Small hoplike fruits; shake over bag,100,Best grown from fresh seed; slow to establish,no,,no,,cream,,,,cream,#FFF8DC,Ostrya virginiana
Sourwood,Oxydendrum arboreum,,Tree - Large,Native,No,Fall Color + Nectar,Structural,Full Sun–Part Sun,Mesic,Loves acidic soils; stellar fall red,https://inaturalist-open-data.s3.amazonaws.com/photos/396498/medium.JPG,,Woody,N,Medium,4 - Strong,2 - Marginal,3 - OK,3 - OK,5 - Best Fit,2 - Marginal,3 - OK,Yes,Yes,Yes,Yes,Tree,30,,low,low,low,yes,yes,yes,unknown,marginal,avoid,September,October,Small dry capsules in racemes,30,Best grown from fresh seed; slow to establish,no,,no,,white,Summer–Fall,7,10,white,#FFFFFF,Oxydendrum arboreum
Golden Ragwort,Packera aurea,,Flowering Perennial,Native,Partly,Summer / Fall,Low,Part Sun–Shade,Mesic–Moist,Spring bright gold,https://inaturalist-open-data.s3.amazonaws.com/photos/102867/medium.jpg,,Ground,M,Small,4 - Strong,2 - Marginal,3 - OK,5 - Best Fit,4 - Strong,3 - OK,4 - Strong,Yes,Yes,Yes,Yes,Herbaceous,1.5,,low,low,low,yes,yes,yes,unknown,marginal,marginal,May,June,Seeds ripen very early; collect promptly,20,"Ground layering works well — pin a low branch to moist acidic soil in spring, sever the following year. Division not practical; best from softwood cuttings in summer.",no,Toxic,no,,yellow,Mid/Late Summer,6,9,yellow,#F9C820,Packera aurea
Peony,Paeonia lactiflora,,Flowering Perennial,Safe Non-Native,No,Large fragrant blooms; glossy foliage through summer; architectural seed heads in fall,Structural,Full Sun–Part Sun,Mesic,Long-lived perennial. Prefers full sun and well-drained soil. Tolerates heat if soil remains evenly moist. Does not like being transplanted once established. Deer resistant. Excellent for formal or courtyard plantings.,https://inaturalist-open-data.s3.amazonaws.com/photos/113190686/medium.jpg,,,,,Yes,No,Yes,No,Partial,No,No,No,No,No,No,Herbaceous,6,,low,low,low,mild,mild,mild,unknown,avoid,avoid,August,September,Dry follicles; shake seeds out,0,Divide in early spring or fall; resents disturbance — divide carefully,no,,with caveats,Limited traditional medicinal use; consult professional,white | pink | red,Late Spring to Early Summer,5,6,white | pink | red,#FFFFFF,Paeonia lactiflora
Switchgrass,Panicum virgatum,,Grass,Native,No,Summer / Fall / Winter,Structural,Full Sun–Part Sun,Dry–Mesic,Good structure for wildlife cover,https://inaturalist-open-data.s3.amazonaws.com/photos/9682082/medium.jpg,,,,,5 - Best Fit,3 - OK,4 - Strong,4 - Strong,3 - OK,1 - Don't Use,5 - Best Fit,Yes,Yes,Yes,Yes,Herbaceous,5,blue-gray,low,low,low,no,no,no,tolerant,avoid,avoid,October,November,Seeds in open panicle; shake or strip,20,Divide clumps in early spring or fall; easy and vigorous,no,,no,,,Mid/Late Summer,6,9,,,Panicum virgatum
Dallas Blues Switchgrass,Panicum virgatum 'Dallas Blues',,Grass,Native Cultivar,No,Foliage Interest,Structural,Full Sun,Dry–Mesic,Extra-tall blue-foliaged cultivar of native switchgrass reaching 6-7 ft. Strong vertical accent for garden design. Blue foliage turns gold in fall. Seed heads feed birds through winter. Same ecological base as straight species.,,https://upload.wikimedia.org/wikipedia/commons/thumb/b/b7/Panicum_virgatum_Dallas_Blues_3zz.jpg/640px-Panicum_virgatum_Dallas_Blues_3zz.jpg,Anchor,N,Large,3 - OK,4 - Strong,4 - Strong,3 - OK,3 - OK,1 - Don't Use,4 - Strong,No,No,No,No,Herbaceous,7,blue-gray,low,low,low,no,no,no,unknown,avoid,avoid,October,November,Seeds in open panicle; may not come true from seed,20,Divide clumps in early spring or fall; does not come reliably true from seed,no,,no,,pink,Late Summer–Fall,8,10,pink,#E8829A,Panicum virgatum 'Dallas Blues'
Virginia Creeper,Parthenocissus quinquefolia,,Vine,Native,N,Strong red fall color; blue berries for birds,Woody Vine (30–50 ft),Full Sun to Part Shade,Dry to Moist,Fast-growing native climber; valuable for wildlife; can spread but typically manageable in patch context,https://inaturalist-open-data.s3.amazonaws.com/photos/1688748/medium.JPG,,Edge / Vertical Structure,Moderate,Small–Large,4 - Strong,5 - Best Fit,4 - Strong,4 - Strong,5 - Best Fit,3 - OK,4 - Strong,Yes,Yes,Yes,Yes,Vine,50,,medium,low,low,yes,yes,yes,tolerant,marginal,marginal,September,October,Blue-black berries; clean pulp; cold stratify,100,Division not practical; grows easily from cuttings or layering,no,Mildly toxic,no,,,June–July,5,6,,,Parthenocissus quinquefolia
Foxglove Beardtongue,Penstemon digitalis,,Flowering Perennial,Native,No,Spring,Mid,Full Sun–Part Sun,Mesic,White spikes in dry meadow,https://inaturalist-open-data.s3.amazonaws.com/photos/200036822/medium.jpeg,,,,,5 - Best Fit,5 - Best Fit,4 - Strong,3 - OK,3 - OK,3 - OK,5 - Best Fit,Yes,Yes,Yes,Yes,Herbaceous,3,red,low,medium,low,no,no,no,unknown,avoid,avoid,July,August,Dry capsules; shake seeds out,15,"Live staking works — cut stems in late winter before bud break, push 2/3 into moist soil. Also divide suckers in early spring or fall.",no,,no,,white,Late Spring,4,5,white,#FFFFFF,Penstemon digitalis
Hairy Beardtongue,Penstemon hirsutus,,Flowering Perennial,Native,No,Spring,Mid,Full Sun,Dry–Mesic,Purple flowers rocky soils,https://inaturalist-open-data.s3.amazonaws.com/photos/153009367/medium.jpg,,,,,5 - Best Fit,5 - Best Fit,4 - Strong,3 - OK,3 - OK,3 - OK,5 - Best Fit,Yes,Yes,Yes,Yes,Herbaceous,2,,low,low,low,no,no,no,unknown,avoid,avoid,July,August,Dry capsules; shake seeds out,15,"Live staking works well — cut pencil-thick stems in late winter, push 2/3 into moist soil. Also divide suckers in early spring or fall; spreads by root suckers.",no,,no,,lavender | white,Late Spring,4,5,lavender | white,#9B89C4,Penstemon hirsutus
Russian Sage,Perovskia atriplicifolia,,Flowering Perennial,Safe Non-Native,No,Summer / Fall,Structural,Full Sun,Dry,"airy texture, late color in dry sites",https://static.inaturalist.org/photos/417032110/medium.jpeg,,,,,5 - Best Fit,5 - Best Fit,3 - OK,1 - Don't Use,2 - Marginal,1 - Don't Use,5 - Best Fit,No,No,No,No,Herbaceous,4,silver,low,low,low,no,no,no,unknown,avoid,avoid,September,October,Small achenes; collect dry stems,0,Divide in early spring or fall,no,,no,,lavender | blue,Mid/Late Summer,6,9,lavender | blue,#9B89C4,Perovskia atriplicifolia
Persicaria (sterile forms),Persicaria amplexicaulis,,Flowering Perennial,Safe Non-Native,No,Summer/Fall Color,Structural,Full Sun–Part Sun,Mesic–Moist,Very long bloom; thrives in clay; non-spreading sterile forms,https://inaturalist-open-data.s3.amazonaws.com/photos/45118812/medium.jpeg,,,,,4 - Strong,2 - Marginal,4 - Strong,3 - OK,2 - Marginal,1 - Don't Use,4 - Strong,No,No,No,No,Herbaceous,4,,low,low,low,no,no,no,unknown,avoid,avoid,August,September,Small achenes; collect dry spikes,15,Divide in early spring or fall,no,,no,,red | pink,Summer–Fall,7,10,red | pink,#C0392B,Persicaria amplexicaulis
Jumpseed,Persicaria virginiana,,Flowering Perennial,Native,No,Summer / Fall,Mid,Part Sun–Shade,Mesic,One of the best native plants for dry shade — genuinely tolerant of difficult understory conditions including under Norway maple. Seeds eject forcefully when ripe. Variegated cultivars are popular in shade gardens.,https://inaturalist-open-data.s3.amazonaws.com/photos/184431181/medium.jpg,,Ground,N,Small,2 - Marginal,1 - Don't Use,3 - OK,4 - Strong,5 - Best Fit,4 - Strong,1 - Don't Use,Yes,Yes,Yes,Yes,Herbaceous,3,,low,low,low,no,no,no,tolerant,tolerant,tolerant,August,September,Seeds eject when touched — bag stems before ripe or collect carefully,15,Divide in early spring; self-seeds readily under good conditions,with caveats,Young shoots edible cooked,no,,white | pink,Mid/Late Summer,6,9,white | pink,#FFFFFF,Persicaria virginiana
Northern Beech Fern,Phegopteris connectilis,,Fern,Native,No,Groundcover foliage,Low,Shade,Mesic,Low delicate woodland fern; slowly spreading,https://inaturalist-open-data.s3.amazonaws.com/photos/120116816/medium.jpg,,Ground layer,N,Small,2 - Marginal,1 - Don't Use,4 - Strong,3 - OK,5 - Best Fit,5 - Best Fit,1 - Don't Use,Yes,Yes,Yes,Yes,Herbaceous,1,,low,low,low,no,no,no,unknown,marginal,avoid,June,August,"Fern — produces spores, not seeds",5,Divide in early spring as fronds emerge; spreads slowly,no,,no,,,Spring–Fall,3,10,,,Phegopteris connectilis
Broad Beech Fern,Phegopteris hexagonoptera,,Fern,Native,No,Broad arching fronds; woodland carpet,Low,Part Sun–Shade,Mesic,Broad triangular fronds spread horizontally to carpet the woodland floor. Different from Long Beech Fern in its broader fronds and lower-spreading habit. Excellent for moist acidic woodland understory. Spreads slowly by creeping rhizomes to form groundcover colonies.,https://inaturalist-open-data.s3.amazonaws.com/photos/205216708/medium.jpg,,Ground,N,Small,1 - Don't Use,1 - Don't Use,3 - OK,3 - OK,4 - Strong,3 - OK,1 - Don't Use,Yes,Yes,Yes,Yes,Herbaceous,1.5,bright green,low,low,low,no,no,no,unknown,marginal,avoid,July,August,Fern — produces spores; spores ripen midsummer on underside of fronds,2,Divide rhizomes in early spring; prefers moist acid soil; slow to establish — allow to spread naturally,no,,no,,,Spring–Fall,3,10,,,Phegopteris hexagonoptera
Woodland Phlox,Phlox divaricata,,Flowering Perennial,Native,No,Spring woodland flowers,Low,Part Shade–Shade,Mesic,Spring woodland phlox spreading gently through shade,https://inaturalist-open-data.s3.amazonaws.com/photos/3365048/medium.jpg,,Ground layer,N,Small,Spring woodland phlox; good groundcover in shade,,,,,,,Yes,Yes,Yes,Yes,Herbaceous,1,,medium,medium,low,mild,yes,mild,unknown,tolerant,marginal,May,June,Small dry capsules; collect promptly,10,Divide in early spring or fall; spreads by stolons,no,,no,,lavender | blue | white,Spring,3,5,lavender | blue | white,#9B89C4,Phlox divaricata
Garden Phlox (cultivars),Phlox paniculata cultivars,,Flowering Perennial,Near-Native,No,Summer / Fall,Structural,Full Sun–Part Sun,Mesic,"classic summer color, butterfly magnet",,,,,,4 - Strong,2 - Marginal,5 - Best Fit,4 - Strong,3 - OK,1 - Don't Use,4 - Strong,No,No,No,No,Herbaceous,4,,medium,medium,low,no,no,no,unknown,avoid,avoid,August,September,Cultivar — seeds not reliably true,10,Divide in early spring or fall,no,,no,,pink | white | purple | red,Mid/Late Summer,6,9,pink | white | purple | red,#E8829A,Phlox paniculata cultivars
Creeping Phlox,Phlox stolonifera,,Flowering Perennial,Native,No,Spreading spring groundcover,Low,Part Shade–Shade,Mesic,Spreading groundcover phlox for woodland edges,https://inaturalist-open-data.s3.amazonaws.com/photos/324269/medium.jpg,,Ground layer,N,Small,Spreading woodland groundcover phlox,,,,,,,Yes,Yes,Yes,Yes,Herbaceous,1,,medium,medium,low,mild,yes,mild,unknown,tolerant,marginal,May,June,Small dry capsules; collect promptly,10,Divide in early spring or fall; spreads by stolons,no,,no,,pink | purple | white,Spring,3,5,pink | purple | white,#E8829A,Phlox stolonifera
Moss Phlox,Phlox subulata,,Flowering Perennial,Native,Yes,Spring carpet flowers,Low,Sun,Dry,Low mat-forming phlox suited to sunny dry slopes,https://inaturalist-open-data.s3.amazonaws.com/photos/36087958/medium.jpg,,Ground layer,N,Small,4 - Strong,5 - Best Fit,3 - OK,1 - Don't Use,1 - Don't Use,1 - Don't Use,5 - Best Fit,Yes,Yes,Yes,Yes,Herbaceous,1,,low,low,low,mild,yes,mild,unknown,avoid,avoid,May,June,Small dry capsules; collect promptly,10,Divide in early spring or fall; spreads to form mat,no,,no,,pink | purple | white,Spring,3,5,pink | purple | white,#E8829A,Phlox subulata
Ninebark,Physocarpus opulifolius,,Shrub,Native,N,Exfoliating bark; pollinator flowers,Shrub,Full Sun to Part Shade,Mesic to Moist,Excellent structural shrub,https://inaturalist-open-data.s3.amazonaws.com/photos/135237890/medium.jpeg,,Understory fill,N,Small to Medium,4 - Strong,3 - OK,5 - Best Fit,4 - Strong,4 - Strong,3 - OK,3 - OK,Yes,Yes,Yes,Yes,Shrub,8,,low,low,low,no,no,no,tolerant,marginal,marginal,August,September,Small dry follicles in clusters,35,Divide suckers in early spring or fall,no,,no,,white | pink,Late Spring,4,5,white | pink,#FFFFFF,Physocarpus opulifolius
Ninebark (Dark-leaf),Physocarpus opulifolius 'Diabolo',,Shrub,Native Cultivar,No,Foliage + Bark,Structural,Full Sun–Part Sun,Dry–Mesic,Nonnative colors but great structure and pollinator use,,,,,,5 - Best Fit,3 - OK,4 - Strong,3 - OK,3 - OK,2 - Marginal,4 - Strong,No,No,No,No,Shrub,8,,low,low,low,no,no,no,tolerant,marginal,marginal,August,September,Small dry follicles; may not come true,35,May not come true; best from cuttings,no,,no,,white | pink,Spring–Summer,3,7,white | pink,#FFFFFF,Physocarpus opulifolius 'Diabolo'
Ninebark (Compact),Physocarpus opulifolius 'Summer Wine',,Shrub,Native Cultivar,No,Foliage + Bark,Tall,Full Sun–Part Sun,Dry–Mesic,Smaller form; great for tight spaces,,,,,,5 - Best Fit,3 - OK,4 - Strong,3 - OK,3 - OK,2 - Marginal,4 - Strong,No,No,No,No,Shrub,8,,low,low,low,no,no,no,tolerant,marginal,marginal,August,September,Small dry follicles; may not come true,35,May not come true; best from cuttings,no,,no,,white | pink,Spring–Summer,3,7,white | pink,#FFFFFF,Physocarpus opulifolius 'Summer Wine'
Obedient Plant,Physostegia virginiana,,Flowering Perennial,Native,No,Summer Color,Tall,Full Sun–Part Sun,Mesic–Moist,Pink or white spikes; spreads but manageable; strong pollinator plant,https://inaturalist-open-data.s3.amazonaws.com/photos/49931148/medium.jpg,,Anchor,M,Medium,4 - Strong,1 - Don't Use,4 - Strong,5 - Best Fit,3 - OK,1 - Don't Use,4 - Strong,Yes,Yes,Yes,Yes,Herbaceous,4,,low,low,low,no,no,no,unknown,avoid,avoid,September,October,Small dry nutlets; strip from stem,10,"Tip layering works — pin a low branch to moist soil in spring, sever the following year. Also divide suckers in early spring or fall.",no,,no,,pink | white,Summer,6,8,pink | white,#E8829A,Physostegia virginiana
