Rue Anemone,Thalictrum thalictroides,,Flowering Perennial,Native,No,Ephemeral,Low,Shade,Mesic,Delicate spring ephemeral suited to rich woodland soils,https://inaturalist-open-data.s3.amazonaws.com/photos/356908993/medium.jpeg,,Ground layer,N,Small,Spring ephemeral,,,,,,,Yes,Yes,Yes,Yes,Herbaceous,1,blue-gray,low,low,low,mild,mild,mild,unknown,marginal,avoid,June,July,Small achenes; collect when dry,10,Divide in early spring; easy,no,,no,,white | pink,Spring,3,5,white | pink,#FFFFFF,Thalictrum thalictroides
Marsh Fern,Thelypteris palustris,,Fern,Native,No,Wetland foliage,Medium,Sun–Part Shade,Wet,Wetland fern suited to marshy soils and moist woodland edges,https://inaturalist-open-data.s3.amazonaws.com/photos/4839037/medium.jpg,,Understory fill,N,Medium,Wetland fern,,,,,,,Yes,Yes,Yes,Yes,Herbaceous,3,,low,low,low,no,no,no,unknown,avoid,avoid,June,August,"Fern — produces spores, not seeds",5,Divide in early spring as fronds emerge; prefers wet soil,no,,no,,,Spring–Fall,3,10,,,Thelypteris palustris
Carolina Lupine,Thermopsis caroliniana,,Flowering Perennial,Native,No,Yellow flowers,Medium,Sun,Dry–Mesic,Nitrogen-fixing perennial with yellow pea-like flowers,https://inaturalist-open-data.s3.amazonaws.com/photos/13040666/medium.jpg,,Understory fill,N,Medium,4 - Strong,4 - Strong,4 - Strong,2 - Marginal,2 - Marginal,1 - Don't Use,4 - Strong,No,No,Yes,No,Herbaceous,3,,low,low,low,mild,mild,mild,unknown,avoid,avoid,August,September,Dry pods; collect when brown,25,Divide in early spring; forms large clumps over time,no,Toxic raw,no,,yellow,Spring,3,5,yellow,#F9C820,Thermopsis caroliniana
Eastern white cedar / northern white cedar (native arborvitae),Thuja occidentalis,,Midstory Tree,Native,Y,Evergreen structure,Medium Tree,Full Sun to Part Shade,Mesic to Moist,Common native arborvitae,https://inaturalist-open-data.s3.amazonaws.com/photos/4684247/medium.jpeg,,Evergreen structure,N,Medium,3 - OK,2 - Marginal,4 - Strong,4 - Strong,4 - Strong,3 - OK,2 - Marginal,Yes,Yes,Yes,Yes,Tree,40,dark green,high,high,high,mild,mild,mild,sensitive,marginal,avoid,September,October,Small cones; shake seeds out,15,Best grown from seed; difficult to transplant,no,,yes,Traditional medicinal use; used for respiratory and immune support; do not self-prescribe,,Spring,3,5,,,Thuja occidentalis
Foamflower,Tiarella cordifolia,,Groundcover,Native,Partly,Summer / Fall,Low,Part Sun–Shade,Mesic,Spreads gently in rich woods,https://inaturalist-open-data.s3.amazonaws.com/photos/197934244/medium.jpg,,Ground,N,Small,3 - OK,1 - Don't Use,3 - OK,3 - OK,4 - Strong,5 - Best Fit,3 - OK,Yes,Yes,Yes,Yes,Herbaceous,1,,low,medium,low,no,no,no,unknown,tolerant,marginal,June,July,Tiny capsules; shake when dry,10,Divide in early spring or fall; spreads by stolons,no,,no,,white | pink,Fall,9,10,white | pink,#FFFFFF,Tiarella cordifolia
American Linden / Basswood,Tilia americana,,Tall Canopy Tree,Native,No,Summer fragrance,Structural,Full Sun–Part Sun,Mesic,Intensely fragrant flowers in early summer — one of the most important nectar trees for native bees in northeastern North America. Large heart-shaped leaves. Long-lived canopy tree.,https://static.inaturalist.org/photos/404975522/medium.jpeg,,Woody,N,Large,2 - Marginal,2 - Marginal,4 - Strong,4 - Strong,4 - Strong,2 - Marginal,2 - Marginal,Yes,Yes,Yes,Yes,Tree,80,,low,low,low,no,no,no,unknown,marginal,avoid,August,September,Round nutlets on papery bract; cold stratify,150,Difficult from seed (double dormancy); division of suckers possible; best purchased as nursery-grown stock,with caveats,Flowers edible; used in tea and cooking,yes,Flower tea used medicinally for relaxation and colds,yellow | cream,Early Summer,5,6,yellow | cream,#F9C820,Tilia americana
Spiderwort,Tradescantia virginiana,,Flowering Perennial,Near-Native,No,Spring / Summer,Mid,Full Sun–Part Sun,Mesic,"Three-petaled flowers in blue-purple, pink, or white open in the morning. Long bloom season. Adaptable and easy. Native to mid-Atlantic states; performs very well in MA.",https://inaturalist-open-data.s3.amazonaws.com/photos/21373805/medium.jpeg,,Matrix,N,Small,3 - OK,3 - OK,4 - Strong,4 - Strong,4 - Strong,2 - Marginal,3 - OK,Yes,Yes,Yes,Yes,Herbaceous,2,,medium,low,low,no,no,no,unknown,marginal,marginal,July,August,Small dry capsules; collect when dry,10,Divide in early spring; very easy — forms large clumps,with caveats,Young shoots edible cooked,no,,blue | purple | pink | white,Late Spring–Summer,5,7,blue | purple | pink | white,#4A7FC1,Tradescantia virginiana
Forked Bluecurls,Trichostema dichotomum,,Flowering Perennial,Native,No,Intensely blue-violet flowers; fragrant; dry barrens specialist,Low,Full Sun,Dry,"Intensely fragrant annual of hot, sandy, dry, acidic soils — pine barrens, sandy road edges, granite outcrops. Striking blue-violet flowers with long curved stamens. Highly attractive to bumblebees. Self-seeding in suitable conditions. One of the most distinctive plants of dry open habitats in the Northeast.",https://static.inaturalist.org/photos/235148340/medium.jpg,,Matrix,N,Small,4 - Strong,5 - Best Fit,2 - Marginal,1 - Don't Use,2 - Marginal,1 - Don't Use,5 - Best Fit,Yes,Yes,Yes,Yes,Herbaceous,1.5,green,low,low,low,no,no,no,unknown,tolerant,avoid,September,October,Tiny nutlets in persistent calyces; collect when dry; direct sow on bare sandy soil in fall,5,Direct sow on bare sandy soil in fall; requires bare mineral soil and full sun; do not mulch — mulch prevents germination,no,,no,,blue | violet,Late Summer–Fall,8,10,blue | violet,#4A7FC1,Trichostema dichotomum
Toad Lily,Tricyrtis hirta,,Flowering Perennial,Safe Non-Native,No,Summer / Fall,Mid,Part Sun–Shade,Mesic,late exotic looking flowers in shade,https://inaturalist-open-data.s3.amazonaws.com/photos/1177872/medium.jpg,,,,,2 - Marginal,2 - Marginal,3 - OK,4 - Strong,5 - Best Fit,4 - Strong,2 - Marginal,No,No,No,No,Herbaceous,2,,low,low,low,no,no,no,unknown,marginal,marginal,October,November,Small capsules in leaf axils,0,Divide in early spring or fall; spreads slowly by rhizome,no,,no,,purple | white,Mid/Late Summer,6,9,purple | white,#7B4EA0,Tricyrtis hirta
Nodding Trillium,Trillium cernuum,,Foliage Perennial,Native,No,Spring,Low,Part Sun–Shade,Mesic–Moist,Moist forest specialist,https://inaturalist-open-data.s3.amazonaws.com/photos/3807211/medium.jpg,,Ground,N,Small,2 - Marginal,1 - Don't Use,3 - OK,4 - Strong,4 - Strong,4 - Strong,2 - Marginal,Yes,Yes,Yes,Yes,Herbaceous,1,,high,medium,low,mild,mild,mild,unknown,avoid,avoid,July,August,Dark berries; clean pulp; cold stratify,5,Divide in early spring as shoots emerge; slow — don't disturb unnecessarily,no,,no,,white,Early Spring,2,3,white,#FFFFFF,Trillium cernuum
Red Trillium,Trillium erectum,,Foliage Perennial,Native,No,Spring,Low,Part Sun–Shade,Mesic,Spring ephemeral,https://inaturalist-open-data.s3.amazonaws.com/photos/2802581/medium.jpg,,Ground,N,Small,2 - Marginal,1 - Don't Use,3 - OK,4 - Strong,4 - Strong,4 - Strong,2 - Marginal,Yes,Yes,Yes,Yes,Herbaceous,1,,high,medium,low,mild,mild,mild,unknown,marginal,avoid,July,August,Dark berries; clean pulp; cold stratify,5,Divide in early spring as shoots emerge; slow — don't disturb unnecessarily,no,,no,,maroon | red,Early Spring,2,3,maroon | red,#7B2340,Trillium erectum
Great White Trillium,Trillium grandiflorum,,Flowering Perennial,Native,No,Ephemeral,Low,Shade,Mesic,Classic woodland spring ephemeral with slow growth,https://inaturalist-open-data.s3.amazonaws.com/photos/80252/medium.jpg,,Ground layer,N,Small,Spring ephemeral woodland plant,,,,,,,Yes,Yes,Yes,Yes,Herbaceous,1,,high,medium,low,mild,mild,mild,unknown,marginal,avoid,July,August,Dark berries; clean pulp; cold stratify,5,Divide in early spring as shoots emerge; slow — don't disturb unnecessarily,no,Protected species — do not harvest,no,,white,Spring,3,5,white,#FFFFFF,Trillium grandiflorum
Yellow Trillium,Trillium luteum,,Flowering Perennial,Native,No,Ephemeral,Low,Shade,Mesic,Spring trillium with mottled leaves and yellow flowers,https://inaturalist-open-data.s3.amazonaws.com/photos/65672692/medium.jpeg,,Ground layer,N,Small,Spring woodland ephemeral,,,,,,,No,No,Yes,No,Herbaceous,1,,high,medium,low,mild,mild,mild,unknown,marginal,avoid,July,August,Dark berries; clean pulp; cold stratify,5,Divide in early spring as shoots emerge; slow — don't disturb unnecessarily,no,,no,,yellow | green,Spring,3,5,yellow | green,#F9C820,Trillium luteum
Eastern Hemlock,Tsuga canadensis,,Tree - Large,Native,Yes,Spring / Summer,Structural,Part Sun–Shade,Mesic,Deep shade evergreen,https://inaturalist-open-data.s3.amazonaws.com/photos/400071107/medium.jpeg,,Woody,N,Large,2 - Marginal,1 - Don't Use,3 - OK,4 - Strong,4 - Strong,5 - Best Fit,2 - Marginal,Yes,Yes,Yes,Yes,Tree,70,dark green,high,medium,high,no,no,no,sensitive,tolerant,marginal,September,October,Small cones; winged seeds disperse quickly,160,Best grown from fresh seed or purchased; difficult to transplant,with caveats,Young needles edible; used in hemlock tip tea,yes,Needle tea used medicinally; high in vitamin C,,Late Spring,4,5,,,Tsuga canadensis
Common Cattail,Typha latifolia,,Grass,Native,No,Cattail spikes; wetland structure; wildlife habitat,Structural,Full Sun,Wet–Aquatic,The quintessential wetland plant. Forms dense stands in marshes and pond edges. Excellent wildlife habitat for red-winged blackbirds and muskrats. Very aggressive in standing water — best in large wetland settings or where spread can be managed. Multiple edible parts.,https://inaturalist-open-data.s3.amazonaws.com/photos/4280840/medium.jpeg,,Matrix,M,Large,1 - Don't Use,1 - Don't Use,1 - Don't Use,5 - Best Fit,2 - Marginal,1 - Don't Use,1 - Don't Use,Yes,Yes,Yes,Yes,Herbaceous,8,green,low,low,low,no,no,no,unknown,avoid,avoid,September,October,Fluffy seed mass from cattail spike; collect before dispersal; surface sow on wet soil,5,Divide rhizomes in early spring — very vigorous; plant in submerged pots to control spread,yes,"Young shoots, pollen, and green spikes all edible in season",no,,brown | tan,Early Summer,5,6,brown | tan,#8B6347,Typha latifolia
Lowbush Blueberry,Vaccinium angustifolium,,Shrub – Low,Native,No,Summer Fruit,Ground / Low Shrub,Full Sun–Part Sun,Dry–Mesic,Low native blueberry,https://inaturalist-open-data.s3.amazonaws.com/photos/56287/medium.jpg,,Woody,Y,Small,4 - Strong,4 - Strong,4 - Strong,3 - OK,3 - OK,2 - Marginal,4 - Strong,Yes,Yes,Yes,Yes,Shrub,2,green,medium,medium,medium,no,no,no,tolerant,marginal,tolerant,July,August,Edible berries,250,Spreads by rhizomes,yes,Edible berries; lowbush blueberry,no,,white,Spring,3,5,white,#FFFFFF,Vaccinium angustifolium
Highbush Blueberry,Vaccinium corymbosum,,Shrub – Large,Native,No,Fall / Winter,Structural,Full Sun–Part Sun,Mesic–Moist,"Fruit for wildlife, fall color",https://inaturalist-open-data.s3.amazonaws.com/photos/216577733/medium.jpg,,Woody,N,Medium,4 - Strong,2 - Marginal,4 - Strong,5 - Best Fit,4 - Strong,3 - OK,4 - Strong,Yes,Yes,Yes,Yes,Shrub,6,,high,high,high,no,no,no,sensitive,tolerant,avoid,July,August,Blue berries; clean pulp; acid scarify,250,Division not practical; best from softwood cuttings in summer,yes,Edible berries; highbush blueberry,no,,white | pink,Late Spring,4,5,white | pink,#FFFFFF,Vaccinium corymbosum
Cranberry (groundcover),Vaccinium macrocarpon,,Groundcover,Native,N,Red fruit,Low Shrub,Full Sun,Moist to Wet,Spreading wetland groundcover,https://inaturalist-open-data.s3.amazonaws.com/photos/259774277/medium.jpeg,,Ground layer,Y,Small,3 - OK,1 - Don't Use,3 - OK,5 - Best Fit,3 - OK,1 - Don't Use,1 - Don't Use,Yes,Yes,Yes,Yes,Herbaceous,0.5,dark green,medium,medium,medium,no,no,no,sensitive,avoid,avoid,September,October,Red berries; clean pulp; acid scarify,250,Division not practical; best from softwood cuttings in summer,yes,Cranberries edible,yes,Cranberry used medicinally for urinary tract health,pink,Summer,6,8,pink,#E8829A,Vaccinium macrocarpon
Tall Verbena,Verbena bonariensis,,Flowering Perennial,Safe Non-Native,No,Summer/Fall Color,Structural,Full Sun,Dry–Mesic,Light airy reseeder; huge pollinator draw,https://inaturalist-open-data.s3.amazonaws.com/photos/283884295/medium.jpg,,,,,5 - Best Fit,3 - OK,4 - Strong,3 - OK,2 - Marginal,1 - Don't Use,5 - Best Fit,No,No,No,No,Herbaceous,4,,low,low,low,no,no,no,unknown,avoid,avoid,September,October,Small nutlets; strip dry stems,10,Divide in early spring; short-lived — allow to reseed,no,,no,,purple,Summer–Fall,7,10,purple,#7B4EA0,Verbena bonariensis
Blue Vervain,Verbena hastata,,Flowering Perennial,Native,No,Pollinator flowers,Large,Sun–Part Shade,Moist,Wet meadow perennial attractive to many pollinators,https://static.inaturalist.org/photos/6560152/medium.jpeg,,Understory fill,N,Large,Wet meadow pollinator plant,,,,,,,Yes,Yes,Yes,Yes,Herbaceous,8,,low,low,low,no,no,no,unknown,avoid,avoid,September,October,Small nutlets; strip from dry stem,10,Divide in early spring or fall,no,,yes,Traditional medicinal herb; used for fever and respiratory complaints,blue | purple,Summer,6,8,blue | purple,#4A7FC1,Verbena hastata
White Vervain,Verbena urticifolia,,Flowering Perennial,Native,No,Pollinator plant,Tall,Part Shade,Mesic,Tall airy perennial that supports many insect species,https://inaturalist-open-data.s3.amazonaws.com/photos/9197315/medium.jpeg,,Understory fill,N,Medium,3 - OK,2 - Marginal,4 - Strong,3 - OK,4 - Strong,4 - Strong,2 - Marginal,Yes,Yes,Yes,Yes,Herbaceous,5,,low,low,low,no,no,no,unknown,marginal,marginal,September,October,Small nutlets; strip from dry stem,10,Divide in early spring or fall,no,,yes,Traditional medicinal herb,white,Summer,6,8,white,#FFFFFF,Verbena urticifolia
Wingstem,Verbesina alternifolia,,Flowering Perennial,Native,No,Fall Color,Structural,Full Sun–Part Sun,Mesic–Moist,Tall native daisy with winged stems. Late-season pollinator magnet. At the northern edge of its range in MA but performs well in the Lexington microclimate.,https://static.inaturalist.org/photos/229484444/medium.jpg,,Anchor,N,Medium,3 - OK,2 - Marginal,4 - Strong,5 - Best Fit,4 - Strong,2 - Marginal,2 - Marginal,Yes,Yes,Yes,Yes,Herbaceous,8,,low,low,low,no,no,no,unknown,marginal,marginal,September,October,Winged achenes; collect dry heads,20,Divide in early spring or fall,no,,no,,yellow,Late Summer–Fall,8,10,yellow,#F9C820,Verbesina alternifolia
Ironweed,Vernonia noveboracensis,,Flowering Perennial,Native,No,Purple flowers,Tall,Sun,Moist,Tall late-season nectar plant important for pollinators,https://inaturalist-open-data.s3.amazonaws.com/photos/92055781/medium.jpeg,,Understory fill,N,Large,4 - Strong,2 - Marginal,4 - Strong,5 - Best Fit,3 - OK,2 - Marginal,2 - Marginal,Yes,Yes,Yes,Yes,Herbaceous,6,,low,low,low,no,no,no,unknown,avoid,avoid,September,October,Fluffy achenes; collect before dispersal,15,Divide in early spring or fall; forms large clumps,no,,no,,purple,Late Summer,7,9,purple,#7B4EA0,Vernonia noveboracensis
Culver’s Root,Veronicastrum virginicum,,Flowering Perennial,Native,No,Vertical flowers,Tall,Sun–Part Shade,Mesic,Tall perennial with distinctive vertical flower spikes,https://inaturalist-open-data.s3.amazonaws.com/photos/2173863/medium.jpg,,Understory fill,N,Large,Vertical pollinator plant,,,,,,,Yes,Yes,Yes,Yes,Herbaceous,5,,low,low,low,mild,mild,mild,unknown,avoid,avoid,September,October,Dry capsules; shake seeds out,15,Divide in early spring or fall,no,,no,,white | lavender,Summer,6,8,white | lavender,#FFFFFF,Veronicastrum virginicum
Arrowwood Viburnum,Viburnum dentatum,,Shrub,Native,No,Berries + Fall Color,Structural,Full Sun–Part Sun,Mesic,Tolerates varied soils; great bird plant,https://inaturalist-open-data.s3.amazonaws.com/photos/197714531/medium.jpg,,Woody,N,Medium,4 - Strong,3 - OK,4 - Strong,3 - OK,4 - Strong,2 - Marginal,4 - Strong,Yes,Yes,Yes,Yes,Shrub,10,,medium,medium,low,no,no,no,tolerant,marginal,avoid,August,September,Blue-black drupes; clean pulp; cold stratify,100,Divide suckers in early spring or fall,with caveats,Fruit edible; bitter and astringent,no,,white,Spring–Fall,3,10,white,#FFFFFF,Viburnum dentatum
Nannyberry,Viburnum lentago,,Tree - Small,Native,N,Dark berries,Small Tree,Full Sun to Part Shade,Mesic,Multi-season interest,https://inaturalist-open-data.s3.amazonaws.com/photos/172175665/medium.jpg,,Midstory fill,N,Medium,4 - Strong,3 - OK,4 - Strong,3 - OK,4 - Strong,3 - OK,3 - OK,Yes,Yes,Yes,Yes,Tree,15,,medium,medium,low,no,no,no,unknown,marginal,marginal,September,October,Blue-black drupes; clean pulp; cold stratify,100,Divide suckers in early spring or fall,yes,Edible fruit; nannyberry,no,,white | cream,Late Spring,4,5,white | cream,#FFFFFF,Viburnum lentago
Smooth Witherod,Viburnum nudum,,Shrub,Native,No,Berries + Fall Color,Structural,Full Sun–Part Sun,Mesic–Moist,Pink-to-blue berries; loves moisture,https://inaturalist-open-data.s3.amazonaws.com/photos/219829327/medium.jpg,,Woody,N,Medium,4 - Strong,1 - Don't Use,3 - OK,5 - Best Fit,4 - Strong,2 - Marginal,4 - Strong,Yes,Yes,Yes,Yes,Shrub,8,,medium,medium,low,no,no,no,unknown,avoid,avoid,August,September,Blue-black drupes; clean pulp; cold stratify,100,Divide suckers in early spring or fall,with caveats,Fruit edible; astringent,no,,white,Summer–Fall,7,10,white,#FFFFFF,Viburnum nudum
Blackhaw Viburnum,Viburnum prunifolium,,Shrub – Large,Native,No,,Structural,Full Sun–Part Sun,Dry–Mesic,"Borderline small tree, I defaulted to shrub",https://inaturalist-open-data.s3.amazonaws.com/photos/35211762/medium.jpg,,Woody,N,Medium,4 - Strong,2 - Marginal,4 - Strong,4 - Strong,4 - Strong,3 - OK,4 - Strong,Yes,Yes,Yes,Yes,Shrub,12,,medium,medium,low,no,no,no,tolerant,marginal,marginal,September,October,Blue-black drupes; clean pulp; cold stratify,100,Divide suckers in early spring or fall,yes,Edible fruit; blackhaw,no,,white,,,,white,#FFFFFF,Viburnum prunifolium
Highbush cranberry,Viburnum trilobum,,Shrub,Native,N,Red berries,Shrub,Full Sun to Part Shade,Mesic to Moist,Bird-supporting shrub,https://inaturalist-open-data.s3.amazonaws.com/photos/10624525/medium.jpeg,,Understory fill,N,Small to Medium,4 - Strong,3 - OK,4 - Strong,4 - Strong,4 - Strong,3 - OK,3 - OK,Yes,Yes,Yes,Yes,Shrub,10,,medium,medium,low,no,no,no,unknown,marginal,avoid,August,September,Red drupes; clean pulp; cold stratify,100,Divide suckers in early spring or fall,yes,Edible fruit; highbush cranberry,no,,white,Late Spring,4,5,white,#FFFFFF,Viburnum trilobum
Canada violet,Viola canadensis,,Groundcover,Native,No,Flowers,Low,Shade–Part Shade,Mesic,Woodland violet,https://inaturalist-open-data.s3.amazonaws.com/photos/125678/medium.jpg,,Ground layer,N,Small,3 - OK,2 - Marginal,4 - Strong,3 - OK,5 - Best Fit,4 - Strong,2 - Marginal,Yes,Yes,Yes,Yes,Herbaceous,1,green,low,low,low,no,no,no,tolerant,tolerant,tolerant,May,June,Shade tolerant,30,Spreads moderately,with caveats,Edible leaves and flowers; mild flavor,no,,white,Spring,3,5,white,#FFFFFF,Viola canadensis
Sweet violet,Viola odorata,,Groundcover,Non-native,No,Flowers,Low,Part Shade,Mesic,Common ornamental violet,https://inaturalist-open-data.s3.amazonaws.com/photos/63834973/medium.jpg,,Ground layer,Y,Small,3 - OK,3 - OK,4 - Strong,3 - OK,4 - Strong,3 - OK,2 - Marginal,No,No,No,No,Herbaceous,0.5,green,low,low,low,no,no,no,tolerant,tolerant,tolerant,May,June,Spreads aggressively,30,Common garden plant,with caveats,Edible flowers and leaves; used in cooking and garnish,no,,purple,Spring,3,5,purple,#7B4EA0,Viola odorata
Bird's Foot Violet,Viola pedata,,Flowering Perennial,Native,No,Showy spring flowers; distinctive deeply cut foliage; dry site,Low,Full Sun–Part Sun,Dry,The showiest native violet — large bicolored or all-purple flowers on deeply lobed bird's foot-shaped leaves. Dry sandy acidic soils — pine barrens and sandy road banks. Does not spread aggressively. Difficult to transplant; best started from seed sown in place or in containers.,https://static.inaturalist.org/photos/340500/medium.jpg,,Ground,N,Small,3 - OK,5 - Best Fit,2 - Marginal,1 - Don't Use,2 - Marginal,1 - Don't Use,4 - Strong,Yes,Yes,Yes,Yes,Herbaceous,0.5,green,low,low,low,no,no,no,unknown,tolerant,avoid,May,June,Cleistogamous seed capsules eject seeds explosively; collect just before pods open; sow fresh or cold stratify,25,Seed sown fresh in summer; difficult to divide — long taproot; best started from seed in containers then transplanted carefully,with caveats,Flowers edible,no,,purple | lavender,Spring,3,5,purple | lavender,#7B4EA0,Viola pedata
Sweet White Violet,Viola pubescens,,Flowering Perennial,Native,No,Ephemeral,Low,Shade,Mesic,Shade-tolerant violet providing early nectar,https://inaturalist-open-data.s3.amazonaws.com/photos/142788573/medium.jpg,,Ground layer,N,Small,Spreading woodland violet,,,,,,,Yes,Yes,Yes,Yes,Herbaceous,0.5,,high,high,low,no,no,no,unknown,tolerant,marginal,May,June,Small capsules; collect before ants take seeds,30,Divide in early spring or fall; spreads by stolons,with caveats,Edible leaves; mild flavor,no,,yellow,Spring,3,5,yellow,#F9C820,Viola pubescens
Blue violet,Viola sororia,,Groundcover,Native,No,Flowers + groundcover,Low,Part Shade–Shade,Mesic,Common violet,https://inaturalist-open-data.s3.amazonaws.com/photos/19508334/medium.jpeg,,Ground layer,Y,Small,4 - Strong,3 - OK,4 - Strong,3 - OK,5 - Best Fit,4 - Strong,2 - Marginal,Yes,Yes,Yes,Yes,Herbaceous,0.5,green,low,low,low,no,no,no,tolerant,tolerant,tolerant,May,June,Self spreads,30,Spreads by seed and rhizomes,with caveats,Edible leaves and flowers; good source of vitamin C,no,,purple,Spring,3,5,purple,#7B4EA0,Viola sororia
Striped Violet / Cream Violet,Viola striata,,Flowering Perennial,Native,No,Cream-white flowers; shade groundcover; Fritillary host,Low,Part Sun–Shade,Mesic,Cream-white flowers with distinctive purple veining. Woodland violet adapted to rich moist forest floors. More vigorous than many violets — spreads by stolons and self-seeds gently. Good shade groundcover. Important host plant for Great Spangled and other Fritillary butterflies.,https://static.inaturalist.org/photos/282933165/medium.jpg,,Ground,N,Small,1 - Don't Use,1 - Don't Use,3 - OK,4 - Strong,5 - Best Fit,3 - OK,1 - Don't Use,Yes,Yes,Yes,Yes,Herbaceous,0.75,green,low,low,low,no,no,no,tolerant,marginal,marginal,May,June,Capsules eject seeds; collect just before pods open; sow fresh,25,Divide in early spring or fall; also self-seeds; easy to propagate and establish,with caveats,Flowers edible,no,,white | cream,Spring,3,5,white | cream,#FFFFFF,Viola striata
Walter’s violet,Viola walteri,,Groundcover,Native,No,Flowers,Low,Shade–Part Shade,Mesic,Semi-evergreen violet,https://static.inaturalist.org/photos/19946212/medium.jpg,,Ground layer,Y,Small,3 - OK,2 - Marginal,4 - Strong,3 - OK,5 - Best Fit,4 - Strong,2 - Marginal,Yes,Yes,Yes,Yes,Herbaceous,0.5,green,low,low,low,no,no,no,tolerant,tolerant,tolerant,May,June,Spreads moderately,30,Good woodland filler,with caveats,Edible leaves,no,,purple,Spring,3,5,purple,#7B4EA0,Viola walteri
Summer Grape,Vitis aestivalis,,Woody Vine,Native,No,Summer Fruit,Climbing,Full Sun–Part Sun,Dry–Mesic,Upland grape,https://inaturalist-open-data.s3.amazonaws.com/photos/46768846/medium.jpeg,,Woody,N,Medium,4 - Strong,4 - Strong,4 - Strong,3 - OK,3 - OK,2 - Marginal,4 - Strong,Yes,Yes,Yes,Yes,Vine,40,purple,medium,medium,medium,no,no,no,tolerant,tolerant,tolerant,August,September,Edible fruit,100,Seed or cuttings,yes,Edible fruit; summer grape,no,,green,Late Spring,4,5,green,#5A9E5A,Vitis aestivalis
Fox Grape,Vitis labrusca,,Woody Vine,Native,No,Summer / Fall Fruit,Climbing,Full Sun–Part Sun,Mesic–Moist,Native grape; high wildlife value,https://inaturalist-open-data.s3.amazonaws.com/photos/10367171/medium.jpeg,,Woody,N,Medium,4 - Strong,3 - OK,4 - Strong,4 - Strong,3 - OK,2 - Marginal,3 - OK,Yes,Yes,Yes,Yes,Vine,30,purple,medium,medium,medium,no,no,no,tolerant,tolerant,tolerant,September,October,Edible fruit,100,Layering or cuttings,yes,Edible fruit; fox grape,no,,green,Late Spring,4,5,green,#5A9E5A,Vitis labrusca
Concord Grape,"Vitis labrusca ""Concord""",,Woody Vine,Native Cultivar,No,Summer / Fall Fruit,Climbing,Full Sun–Part Sun,Mesic–Moist,Cultivar of native grape,https://inaturalist-open-data.s3.amazonaws.com/photos/10367171/medium.jpeg,,Woody,N,Medium,4 - Strong,3 - OK,4 - Strong,4 - Strong,3 - OK,2 - Marginal,3 - OK,No,No,No,No,Vine,30,purple,medium,medium,medium,no,no,no,tolerant,tolerant,tolerant,September,October,Edible fruit (cultivar),100,Cuttings,yes,Edible fruit; Concord grape,no,,green,Late Spring,4,5,green,#5A9E5A,"Vitis labrusca ""Concord"""
Riverbank Grape,Vitis riparia,,Woody Vine,Native,No,Summer Fruit,Climbing,Full Sun–Part Sun,Moist,Riparian grape,https://inaturalist-open-data.s3.amazonaws.com/photos/59477130/medium.jpeg,,Woody,Y,Medium,3 - OK,2 - Marginal,4 - Strong,5 - Best Fit,3 - OK,2 - Marginal,3 - OK,Yes,Yes,Yes,Yes,Vine,40,purple,medium,medium,medium,no,no,no,tolerant,tolerant,tolerant,August,September,Edible fruit (tart),100,Layering,yes,Edible fruit; riverbank grape,no,,green,Late Spring,4,5,green,#5A9E5A,Vitis riparia
Barren strawberry (Siberian),Waldsteinia ternata,,Groundcover,Safe Non-Native,No,Foliage + flowers,Low,Shade–Part Shade,Mesic,"Mat-forming groundcover; can be confused with native ""appalachian"" barren strawberry. Not native but safe for gardne use. ",https://static.inaturalist.org/photos/28145272/medium.jpg,,Ground layer,Y,Small,4 - Strong,3 - OK,4 - Strong,3 - OK,5 - Best Fit,4 - Strong,2 - Marginal,No,No,No,No,Herbaceous,0.5,green,low,low,low,no,no,no,tolerant,tolerant,tolerant,May,June,Spreads by runners,10,Good lawn replacement,no,,no,,yellow,Spring,3,5,yellow,#F9C820,Waldsteinia ternata
